title,subheader,url,h1,h2,h3,keywords
En France,Learn about En France and its benefits,,En France Overview,What is En France?,En France Benefits,"En France, benefits, overview"
En Ligne,Learn about En Ligne and its benefits,,En Ligne Overview,What is En Ligne?,En Ligne Benefits,"En Ligne, benefits, overview"
Cbd En,Learn about Cbd En and its benefits,,Cbd En Overview,What is Cbd En?,Cbd En Benefits,"Cbd En, benefits, overview"
In France,Learn about In France and its benefits,,In France Overview,What is In France?,In France Benefits,"In France, benefits, overview"
Cbd France,Learn about Cbd France and its benefits,,Cbd France Overview,What is Cbd France?,Cbd France Benefits,"Cbd France, benefits, overview"
Sale Of,Learn about Sale Of and its benefits,,Sale Of Overview,What is Sale Of?,Sale Of Benefits,"Sale Of, benefits, overview"
Ban On,Learn about Ban On and its benefits,,Ban On Overview,What is Ban On?,Ban On Benefits,"Ban On, benefits, overview"
Cannabis Légal,Learn about Cannabis Légal and its benefits,,Cannabis Légal Overview,What is Cannabis Légal?,Cannabis Légal Benefits,"Cannabis Légal, benefits, overview"
De Cbd,Learn about De Cbd and its benefits,,De Cbd Overview,What is De Cbd?,De Cbd Benefits,"De Cbd, benefits, overview"
Vente De,Learn about Vente De and its benefits,,Vente De Overview,What is Vente De?,Vente De Benefits,"Vente De, benefits, overview"
De Fleurs,Learn about De Fleurs and its benefits,,De Fleurs Overview,What is De Fleurs?,De Fleurs Benefits,"De Fleurs, benefits, overview"
Cannabidiol Cbd,Learn about Cannabidiol Cbd and its benefits,,Cannabidiol Cbd Overview,What is Cannabidiol Cbd?,Cannabidiol Cbd Benefits,"Cannabidiol Cbd, benefits, overview"
The Sale,Learn about The Sale and its benefits,,The Sale Overview,What is The Sale?,The Sale Benefits,"The Sale, benefits, overview"
De Cannabis,Learn about De Cannabis and its benefits,,De Cannabis Overview,What is De Cannabis?,De Cannabis Benefits,"De Cannabis, benefits, overview"
De Produits,Learn about De Produits and its benefits,,De Produits Overview,What is De Produits?,De Produits Benefits,"De Produits, benefits, overview"
Du Cbd,Learn about Du Cbd and its benefits,,Du Cbd Overview,What is Du Cbd?,Du Cbd Benefits,"Du Cbd, benefits, overview"
Légal En,Learn about Légal En and its benefits,,Légal En Overview,What is Légal En?,Légal En Benefits,"Légal En, benefits, overview"
Of Hemp,Learn about Of Hemp and its benefits,,Of Hemp Overview,What is Of Hemp?,Of Hemp Benefits,"Of Hemp, benefits, overview"
Of The,Learn about Of The and its benefits,,Of The Overview,What is Of The?,Of The Benefits,"Of The, benefits, overview"
Produits À,Learn about Produits À and its benefits,,Produits À Overview,What is Produits À?,Produits À Benefits,"Produits À, benefits, overview"
À Base,Learn about À Base and its benefits,,À Base Overview,What is À Base?,À Base Benefits,"À Base, benefits, overview"
Cbd Légal,Learn about Cbd Légal and its benefits,,Cbd Légal Overview,What is Cbd Légal?,Cbd Légal Benefits,"Cbd Légal, benefits, overview"
Cbd Oil,Learn about Cbd Oil and its benefits,,Cbd Oil Overview,What is Cbd Oil?,Cbd Oil Benefits,"Cbd Oil, benefits, overview"
Cbd Shop,Learn about Cbd Shop and its benefits,,Cbd Shop Overview,What is Cbd Shop?,Cbd Shop Benefits,"Cbd Shop, benefits, overview"
Des Produits,Learn about Des Produits and its benefits,,Des Produits Overview,What is Des Produits?,Des Produits Benefits,"Des Produits, benefits, overview"
Et De,Learn about Et De and its benefits,,Et De Overview,What is Et De?,Et De Benefits,"Et De, benefits, overview"
Fleurs Et,Learn about Fleurs Et and its benefits,,Fleurs Et Overview,What is Fleurs Et?,Fleurs Et Benefits,"Fleurs Et, benefits, overview"
La Vente,Learn about La Vente and its benefits,,La Vente Overview,What is La Vente?,La Vente Benefits,"La Vente, benefits, overview"
Le Cbd,Learn about Le Cbd and its benefits,,Le Cbd Overview,What is Le Cbd?,Le Cbd Benefits,"Le Cbd, benefits, overview"
Legal In,Learn about Legal In and its benefits,,Legal In Overview,What is Legal In?,Legal In Benefits,"Legal In, benefits, overview"
Les Meilleurs,Learn about Les Meilleurs and its benefits,,Les Meilleurs Overview,What is Les Meilleurs?,Les Meilleurs Benefits,"Les Meilleurs, benefits, overview"
On The,Learn about On The and its benefits,,On The Overview,What is On The?,On The Benefits,"On The, benefits, overview"
A Narcotic,Learn about A Narcotic and its benefits,,A Narcotic Overview,What is A Narcotic?,A Narcotic Benefits,"A Narcotic, benefits, overview"
As The,Learn about As The and its benefits,,As The Overview,What is As The?,As The Benefits,"As The, benefits, overview"
Boutique De,Learn about Boutique De and its benefits,,Boutique De Overview,What is Boutique De?,Boutique De Benefits,"Boutique De, benefits, overview"
Cbd Cannabidiol,Learn about Cbd Cannabidiol and its benefits,,Cbd Cannabidiol Overview,What is Cbd Cannabidiol?,Cbd Cannabidiol Benefits,"Cbd Cannabidiol, benefits, overview"
Court Overturns,Learn about Court Overturns and its benefits,,Court Overturns Overview,What is Court Overturns?,Court Overturns Benefits,"Court Overturns, benefits, overview"
De Chanvre,Learn about De Chanvre and its benefits,,De Chanvre Overview,What is De Chanvre?,De Chanvre Benefits,"De Chanvre, benefits, overview"
De La,Learn about De La and its benefits,,De La Overview,What is De La?,De La Benefits,"De La, benefits, overview"
De Thc,Learn about De Thc and its benefits,,De Thc Overview,What is De Thc?,De Thc Benefits,"De Thc, benefits, overview"
De À,Learn about De À and its benefits,,De À Overview,What is De À?,De À Benefits,"De À, benefits, overview"
Découvrez Notre,Learn about Découvrez Notre and its benefits,,Découvrez Notre Overview,What is Découvrez Notre?,Découvrez Notre Benefits,"Découvrez Notre, benefits, overview"
Fleurs De,Learn about Fleurs De and its benefits,,Fleurs De Overview,What is Fleurs De?,Fleurs De Benefits,"Fleurs De, benefits, overview"
French Court,Learn about French Court and its benefits,,French Court Overview,What is French Court?,French Court Benefits,"French Court, benefits, overview"
Is Cbd,Learn about Is Cbd and its benefits,,Is Cbd Overview,What is Is Cbd?,Is Cbd Benefits,"Is Cbd, benefits, overview"
Less Than,Learn about Less Than and its benefits,,Less Than Overview,What is Less Than?,Less Than Benefits,"Less Than, benefits, overview"
Notre Gamme,Learn about Notre Gamme and its benefits,,Notre Gamme Overview,What is Notre Gamme?,Notre Gamme Benefits,"Notre Gamme, benefits, overview"
Of Cbd,Learn about Of Cbd and its benefits,,Of Cbd Overview,What is Of Cbd?,Of Cbd Benefits,"Of Cbd, benefits, overview"
On Cbd,Learn about On Cbd and its benefits,,On Cbd Overview,What is On Cbd?,On Cbd Benefits,"On Cbd, benefits, overview"
Taux De,Learn about Taux De and its benefits,,Taux De Overview,What is Taux De?,Taux De Benefits,"Taux De, benefits, overview"
The Ban,Learn about The Ban and its benefits,,The Ban Overview,What is The Ban?,The Ban Benefits,"The Ban, benefits, overview"
To The,Learn about To The and its benefits,,To The Overview,What is To The?,To The Benefits,"To The, benefits, overview"
Achat Cbd,Learn about Achat Cbd and its benefits,,Achat Cbd Overview,What is Achat Cbd?,Achat Cbd Benefits,"Achat Cbd, benefits, overview"
Administrative Court,Learn about Administrative Court and its benefits,,Administrative Court Overview,What is Administrative Court?,Administrative Court Benefits,"Administrative Court, benefits, overview"
And Leaf,Learn about And Leaf and its benefits,,And Leaf Overview,What is And Leaf?,And Leaf Benefits,"And Leaf, benefits, overview"
Boutique En,Learn about Boutique En and its benefits,,Boutique En Overview,What is Boutique En?,Boutique En Benefits,"Boutique En, benefits, overview"
Cbd And,Learn about Cbd And and its benefits,,Cbd And Overview,What is Cbd And?,Cbd And Benefits,"Cbd And, benefits, overview"
Cbd Un,Learn about Cbd Un and its benefits,,Cbd Un Overview,What is Cbd Un?,Cbd Un Benefits,"Cbd Un, benefits, overview"
Des Fleurs,Learn about Des Fleurs and its benefits,,Des Fleurs Overview,What is Des Fleurs?,Des Fleurs Benefits,"Des Fleurs, benefits, overview"
Du Décembre,Learn about Du Décembre and its benefits,,Du Décembre Overview,What is Du Décembre?,Du Décembre Benefits,"Du Décembre, benefits, overview"
Découvrez Nos,Learn about Découvrez Nos and its benefits,,Découvrez Nos Overview,What is Découvrez Nos?,Découvrez Nos Benefits,"Découvrez Nos, benefits, overview"
En Gros,Learn about En Gros and its benefits,,En Gros Overview,What is En Gros?,En Gros Benefits,"En Gros, benefits, overview"
Fleurs Huiles,Learn about Fleurs Huiles and its benefits,,Fleurs Huiles Overview,What is Fleurs Huiles?,Fleurs Huiles Benefits,"Fleurs Huiles, benefits, overview"
Flower And,Learn about Flower And and its benefits,,Flower And Overview,What is Flower And?,Flower And Benefits,"Flower And, benefits, overview"
France Cbd,Learn about France Cbd and its benefits,,France Cbd Overview,What is France Cbd?,France Cbd Benefits,"France Cbd, benefits, overview"
Full Spectrum,Learn about Full Spectrum and its benefits,,Full Spectrum Overview,What is Full Spectrum?,Full Spectrum Benefits,"Full Spectrum, benefits, overview"
Gamme De,Learn about Gamme De and its benefits,,Gamme De Overview,What is Gamme De?,Gamme De Benefits,"Gamme De, benefits, overview"
Grossiste Cbd,Learn about Grossiste Cbd and its benefits,,Grossiste Cbd Overview,What is Grossiste Cbd?,Grossiste Cbd Benefits,"Grossiste Cbd, benefits, overview"
Haute Qualité,Learn about Haute Qualité and its benefits,,Haute Qualité Overview,What is Haute Qualité?,Haute Qualité Benefits,"Haute Qualité, benefits, overview"
Huiles Fleurs,Learn about Huiles Fleurs and its benefits,,Huiles Fleurs Overview,What is Huiles Fleurs?,Huiles Fleurs Benefits,"Huiles Fleurs, benefits, overview"
In The,Learn about In The and its benefits,,In The Overview,What is In The?,In The Benefits,"In The, benefits, overview"
La Législation,Learn about La Législation and its benefits,,La Législation Overview,What is La Législation?,La Législation Benefits,"La Législation, benefits, overview"
Made Infrance,Learn about Made Infrance and its benefits,,Made Infrance Overview,What is Made Infrance?,Made Infrance Benefits,"Made Infrance, benefits, overview"
Meilleur Prix,Learn about Meilleur Prix and its benefits,,Meilleur Prix Overview,What is Meilleur Prix?,Meilleur Prix Benefits,"Meilleur Prix, benefits, overview"
Meilleurs Produits,Learn about Meilleurs Produits and its benefits,,Meilleurs Produits Overview,What is Meilleurs Produits?,Meilleurs Produits Benefits,"Meilleurs Produits, benefits, overview"
Nos Huiles,Learn about Nos Huiles and its benefits,,Nos Huiles Overview,What is Nos Huiles?,Nos Huiles Benefits,"Nos Huiles, benefits, overview"
Not A,Learn about Not A and its benefits,,Not A Overview,What is Not A?,Not A Benefits,"Not A, benefits, overview"
Notre Sélection,Learn about Notre Sélection and its benefits,,Notre Sélection Overview,What is Notre Sélection?,Notre Sélection Benefits,"Notre Sélection, benefits, overview"
Of State,Learn about Of State and its benefits,,Of State Overview,What is Of State?,Of State Benefits,"Of State, benefits, overview"
On Sale,Learn about On Sale and its benefits,,On Sale Overview,What is On Sale?,On Sale Benefits,"On Sale, benefits, overview"
Produits Cbd,Learn about Produits Cbd and its benefits,,Produits Cbd Overview,What is Produits Cbd?,Produits Cbd Benefits,"Produits Cbd, benefits, overview"
Sélection De,Learn about Sélection De and its benefits,,Sélection De Overview,What is Sélection De?,Sélection De Benefits,"Sélection De, benefits, overview"
Thc Content,Learn about Thc Content and its benefits,,Thc Content Overview,What is Thc Content?,Thc Content Benefits,"Thc Content, benefits, overview"
To Be,Learn about To Be and its benefits,,To Be Overview,What is To Be?,To Be Benefits,"To Be, benefits, overview"
A Food,Learn about A Food and its benefits,,A Food Overview,What is A Food?,A Food Benefits,"A Food, benefits, overview"
A Government,Learn about A Government and its benefits,,A Government Overview,What is A Government?,A Government Benefits,"A Government, benefits, overview"
A National,Learn about A National and its benefits,,A National Overview,What is A National?,A National Benefits,"A National, benefits, overview"
A Prescription,Learn about A Prescription and its benefits,,A Prescription Overview,What is A Prescription?,A Prescription Benefits,"A Prescription, benefits, overview"
A Thc,Learn about A Thc and its benefits,,A Thc Overview,What is A Thc?,A Thc Benefits,"A Thc, benefits, overview"
Active Cbd,Learn about Active Cbd and its benefits,,Active Cbd Overview,What is Active Cbd?,Active Cbd Benefits,"Active Cbd, benefits, overview"
Allowcbdproducts To,Learn about Allowcbdproducts To and its benefits,,Allowcbdproducts To Overview,What is Allowcbdproducts To?,Allowcbdproducts To Benefits,"Allowcbdproducts To, benefits, overview"
And Perceptions,Learn about And Perceptions and its benefits,,And Perceptions Overview,What is And Perceptions?,And Perceptions Benefits,"And Perceptions, benefits, overview"
And Remain,Learn about And Remain and its benefits,,And Remain Overview,What is And Remain?,And Remain Benefits,"And Remain, benefits, overview"
Approved Temporary,Learn about Approved Temporary and its benefits,,Approved Temporary Overview,What is Approved Temporary?,Approved Temporary Benefits,"Approved Temporary, benefits, overview"
As Food,Learn about As Food and its benefits,,As Food Overview,What is As Food?,As Food Benefits,"As Food, benefits, overview"
As It,Learn about As It and its benefits,,As It Overview,What is As It?,As It Benefits,"As It, benefits, overview"
As Long,Learn about As Long and its benefits,,As Long Overview,What is As Long?,As Long Benefits,"As Long, benefits, overview"
Au Catalogue,Learn about Au Catalogue and its benefits,,Au Catalogue Overview,What is Au Catalogue?,Au Catalogue Benefits,"Au Catalogue, benefits, overview"
Au Meilleur,Learn about Au Meilleur and its benefits,,Au Meilleur Overview,What is Au Meilleur?,Au Meilleur Benefits,"Au Meilleur, benefits, overview"
Available For,Learn about Available For and its benefits,,Available For Overview,What is Available For?,Available For Benefits,"Available For, benefits, overview"
